source,date,assertionType,evidenceType,exactText,modality,statementType,drug1Lab,drug1Type,drug1Role,dose1,drug2Lab,drug2Type,drug2Role,dose2,objectRegimens,objectFormulation,objectDuration,preciptRegimens,preciptFormulation,preciptDuration,numOfParticipants,auc,aucType,aucDirection,cl,clType,clDirection,cmax,cmaxType,cmaxDirection,t12,t12Type,t12Direction
http://dbmi-icode-01.dbmi.pitt.edu:80/DDI-labels/c25f968b-7037-4f60-9a02-2189769b0cbf.html,2015-09-16 15:31:12 -0400,DDI-clinical-trial,evidence-supports,"Digoxin–In a placebo-controlled trial in normal volunteers, administration of sertraline for 17 days (including 200 mg/day for the last 10 days) did not change serum digoxin levels or digoxin renal clearance.",ncit:negative,ncit:quantitative,sertraline,http://dbmi-icode-01.dbmi.pitt.edu:2020/vocab/resource/active-ingredient,dikbD2R:precipitant-drug-of-interaction,Unk,digoxin,http://dbmi-icode-01.dbmi.pitt.edu:2020/vocab/resource/active-ingredient,dikbD2R:object-drug-of-interaction,200,UNK,UNK,Unk,Daily,Oral,17,10,Unk,UNK,UNK,Unk,UNK,UNK,Unk,UNK,UNK,Unk,UNK,UNK
http://dbmi-icode-01.dbmi.pitt.edu:80/DDI-labels/c25f968b-7037-4f60-9a02-2189769b0cbf.html,2015-09-16 15:31:12 -0400,DDI-clinical-trial,evidence-supports,"Cimetidine–In a study assessing disposition of sertraline (100 mg) on the second of 8 days of cimetidine administration (800 mg daily), there were significant increases in sertraline mean AUC (50%), Cmax (24%) and half-life (26%) compared to the placebo group. The clinical significance of these changes is unknown.",ncit:positive,ncit:quantitative,sertraline,http://dbmi-icode-01.dbmi.pitt.edu:2020/vocab/resource/active-ingredient,dikbD2R:object-drug-of-interaction,100,cimetidine,http://dbmi-icode-01.dbmi.pitt.edu:2020/vocab/resource/active-ingredient,dikbD2R:precipitant-drug-of-interaction,800,SD,Oral,2,Daily,Oral,8,Unk,50,Percent,Increase,Unk,UNK,UNK,24,Percent,Increase,26,Percent,Increase
http://dbmi-icode-01.dbmi.pitt.edu:80/DDI-labels/c25f968b-7037-4f60-9a02-2189769b0cbf.html,2015-09-16 15:31:12 -0400,DDI-clinical-trial,evidence-supports,"Hypoglycemic Drugs–In a placebo-controlled trial in normal volunteers, administration of sertraline for 22 days (including 200 mg/day for the final 13 days) caused a statistically significant 16% decrease from baseline in the clearance of tolbutamide following an intravenous 1000 mg dose. Sertraline administration did not noticeably change either the plasma protein binding or the apparent volume of distribution of tolbutamide, suggesting that the decreased clearance was due to a change in the metabolism of the drug. The clinical significance of this decrease in tolbutamide clearance is unknown.",ncit:positive,ncit:quantitative,tolbutamide,http://dbmi-icode-01.dbmi.pitt.edu:2020/vocab/resource/active-ingredient,dikbD2R:object-drug-of-interaction,200,sertraline,http://dbmi-icode-01.dbmi.pitt.edu:2020/vocab/resource/active-ingredient,dikbD2R:precipitant-drug-of-interaction,1000,SD,IV,1,Daily,Oral,22,Unk,Unk,UNK,UNK,16,Percent,Decrease,Unk,UNK,UNK,Unk,UNK,UNK
http://dbmi-icode-01.dbmi.pitt.edu:80/DDI-labels/c25f968b-7037-4f60-9a02-2189769b0cbf.html,2015-09-16 15:31:12 -0400,DDI-clinical-trial,evidence-supports,"Drugs Metabolized by P450 3A4–In three separate in vivo interaction studies, sertraline was co-administered with cytochrome P450 3A4 substrates, terfenadine, carbamazepine, or cisapride under steady-state conditions. The results of these studies indicated that sertraline did not increase plasma concentrations of terfenadine, carbamazepine, or cisapride. These data indicate that sertraline’s extent of inhibition of P450 3A4 activity is not likely to be of clinical significance. Results of the interaction study with cisapride indicate that sertraline 200 mg (q.d.) induces the metabolism of cisapride (cisapride AUC and Cmax were reduced by about 35%).",ncit:positive,ncit:quantitative,cisapride,http://dbmi-icode-01.dbmi.pitt.edu:2020/vocab/resource/active-ingredient,dikbD2R:object-drug-of-interaction,200,sertraline,http://dbmi-icode-01.dbmi.pitt.edu:2020/vocab/resource/active-ingredient,dikbD2R:precipitant-drug-of-interaction,Unk,UNK,UNK,Unk,QD,Oral,Unk,Unk,35,Percent,Decrease,Unk,UNK,UNK,35,Percent,Decrease,Unk,UNK,UNK
http://dbmi-icode-01.dbmi.pitt.edu:80/DDI-labels/c25f968b-7037-4f60-9a02-2189769b0cbf.html,2015-09-16 15:31:12 -0400,DDI-clinical-trial,evidence-supports,"In a study comparing the disposition of intravenously administered diazepam before and after 21 days of dosing with either sertraline (50 to 200 mg/day escalating dose) or placebo, there was a 32% decrease relative to baseline in diazepam clearance for the sertraline group compared to a 19% decrease relative to baseline for the placebo group (p < 0.03). There was a 23% increase in Tmax for desmethyldiazepam in the sertraline group compared to a 20% decrease in the placebo group (p < 0.03). The clinical significance of these changes is unknown.",ncit:positive,ncit:quantitative,sertraline,http://dbmi-icode-01.dbmi.pitt.edu:2020/vocab/resource/active-ingredient,dikbD2R:precipitant-drug-of-interaction,50-200,diazepam,http://dbmi-icode-01.dbmi.pitt.edu:2020/vocab/resource/active-ingredient,dikbD2R:object-drug-of-interaction,Unk,UNK,IV,Unk,Daily,Oral,21,Unk,Unk,UNK,UNK,32,Percent,Decrease,Unk,UNK,UNK,Unk,UNK,UNK
http://dbmi-icode-01.dbmi.pitt.edu:80/DDI-labels/c25f968b-7037-4f60-9a02-2189769b0cbf.html,2015-09-16 15:31:12 -0400,DDI-clinical-trial,evidence-supports,"n a controlled study of a single dose (2 mg) of pimozide, 200 mg sertraline (q.d.) co-administration to steady state was associated with a mean increase in pimozide AUC and Cmax of about 40%, but was not associated with any changes in EKG. Since the highest recommended pimozide dose (10 mg) has not been evaluated in combination with sertraline, the effect on QT interval and PK parameters at doses higher than 2 mg at this time are not known. While the mechanism of this interaction is unknown, due to the narrow therapeutic index of pimozide and due to the interaction noted at a low dose of pimozide, concomitant administration of sertraline and pimozide should be contraindicated (see ",ncit:positive,ncit:quantitative,pimozide,http://dbmi-icode-01.dbmi.pitt.edu:2020/vocab/resource/active-ingredient,dikbD2R:object-drug-of-interaction,200,sertraline,http://dbmi-icode-01.dbmi.pitt.edu:2020/vocab/resource/active-ingredient,dikbD2R:precipitant-drug-of-interaction,2,SD,Oral,1,QD,Oral,Unk,Unk,40,Percent,Increase,Unk,UNK,UNK,40,Percent,Increase,Unk,UNK,UNK
http://dbmi-icode-01.dbmi.pitt.edu:80/DDI-labels/326e8ab0-6886-4749-9544-885b37070051.html,2015-09-14 11:31:14 -0400,DDI-clinical-trial,evidence-supports,"Daily oral dosing of paroxetine (30 mg once daily) increased steady-state AUC0-24, Cmax, and Cmin values of procyclidine (5 mg oral once daily) by 35%, 37%, and 67%, respectively, compared to procyclidine alone at steady state. If anticholinergic effects are seen, the dose of procyclidine should be reduced.",ncit:positive,ncit:quantitative,paroxetine,http://dbmi-icode-01.dbmi.pitt.edu:2020/vocab/resource/active-ingredient,dikbD2R:precipitant-drug-of-interaction,5,procyclidine,http://dbmi-icode-01.dbmi.pitt.edu:2020/vocab/resource/active-ingredient,dikbD2R:object-drug-of-interaction,30,Daily,Oral,Unk,Daily,Oral,Unk,Unk,35,Percent,Increase,Unk,UNK,UNK,37,Percent,Increase,Unk,UNK,UNK
http://dbmi-icode-01.dbmi.pitt.edu:80/DDI-labels/326e8ab0-6886-4749-9544-885b37070051.html,2015-09-14 11:31:14 -0400,DDI-clinical-trial,evidence-supports,"In a study where propranolol (80 mg twice daily) was dosed orally for 18 days, the established steady-state plasma concentrations of propranolol were unaltered during coadministration with paroxetine (30 mg once daily) for the final 10 days. The effects of propranolol on paroxetine have not been evaluated (see ADVERSE REACTIONS: Postmarketing Reports).",ncit:negative,ncit:quantitative,propranolol,http://dbmi-icode-01.dbmi.pitt.edu:2020/vocab/resource/active-ingredient,dikbD2R:object-drug-of-interaction,30,paroxetine,http://dbmi-icode-01.dbmi.pitt.edu:2020/vocab/resource/active-ingredient,dikbD2R:precipitant-drug-of-interaction,80,BID,Oral,18,Daily,Oral,10,Unk,Unk,UNK,UNK,Unk,UNK,UNK,Unk,UNK,UNK,Unk,UNK,UNK
http://dbmi-icode-01.dbmi.pitt.edu:80/DDI-labels/326e8ab0-6886-4749-9544-885b37070051.html,2015-09-14 11:21:10 -0400,DDI-clinical-trial,evidence-supports,"When a single oral 30 mg dose of paroxetine was administered at phenytoin steady state (300 mg once daily for 14 days), paroxetine AUC and T½ were reduced (by an average of 50% and 35%, respectively) compared to paroxetine administered alone. In a separate study, when a single oral 300 mg dose of phenytoin was administered at paroxetine steady state (30 mg once daily for 14 days), phenytoin AUC was slightly reduced (12% on average) compared to phenytoin administered alone. Since both drugs exhibit nonlinear pharmacokinetics, the above studies may not address the case where the 2 drugs are both being chronically dosed. No initial dosage adjustments are considered necessary when these drugs are coadministered; any subsequent adjustments should be guided by clinical effect (see ADVERSE REACTIONS: Postmarketing Reports).",ncit:positive,ncit:quantitative,phenytoin,http://dbmi-icode-01.dbmi.pitt.edu:2020/vocab/resource/active-ingredient,dikbD2R:object-drug-of-interaction,30,paroxetine,http://dbmi-icode-01.dbmi.pitt.edu:2020/vocab/resource/active-ingredient,dikbD2R:precipitant-drug-of-interaction,300,SD,Oral,1,Daily,Oral,14,Unk,12,Percent,Decrease,Unk,UNK,UNK,Unk,UNK,UNK,Unk,UNK,UNK
http://dbmi-icode-01.dbmi.pitt.edu:80/DDI-labels/326e8ab0-6886-4749-9544-885b37070051.html,2015-09-14 11:21:10 -0400,DDI-clinical-trial,evidence-supports,"Concomitant use of paroxetine with risperidone, a CYP2D6 substrate has also been evaluated. In 1 study, daily dosing of paroxetine 20 mg in patients stabilized on risperidone (4 to 8 mg/day) increased mean plasma concentrations of risperidone approximately 4-fold, decreased 9-hydroxyrisperidone concentrations approximately 10%, and increased concentrations of the active moiety (the sum of risperidone plus 9-hydroxyrisperidone) approximately 1.4-fold.",ncit:positive,ncit:quantitative,9-hydroxyrisperidone,http://dbmi-icode-01.dbmi.pitt.edu:2020/vocab/resource/metabolite,dikbD2R:object-drug-of-interaction,20,paroxetine,http://dbmi-icode-01.dbmi.pitt.edu:2020/vocab/resource/active-ingredient,dikbD2R:precipitant-drug-of-interaction,4-8,Daily,Oral,Unk,Daily,Oral,Unk,Unk,10,Percent,Decrease,Unk,UNK,UNK,Unk,UNK,UNK,Unk,UNK,UNK
http://dbmi-icode-01.dbmi.pitt.edu:80/DDI-labels/326e8ab0-6886-4749-9544-885b37070051.html,2015-09-14 11:21:10 -0400,DDI-clinical-trial,evidence-supports,"The steady-state pharmacokinetics of paroxetine was not altered when administered with digoxin at steady state. Mean digoxin AUC at steady state decreased by 15% in the presence of paroxetine. Since there is little clinical experience, the concurrent administration of paroxetine and digoxin should be undertaken with caution.",ncit:positive,ncit:quantitative,digoxin,http://dbmi-icode-01.dbmi.pitt.edu:2020/vocab/resource/active-ingredient,dikbD2R:object-drug-of-interaction,Unk,paroxetine,http://dbmi-icode-01.dbmi.pitt.edu:2020/vocab/resource/active-ingredient,dikbD2R:precipitant-drug-of-interaction,Unk,UNK,UNK,Unk,UNK,UNK,Unk,Unk,15,Percent,Decrease,Unk,UNK,UNK,Unk,UNK,UNK,Unk,UNK,UNK
http://dbmi-icode-01.dbmi.pitt.edu:80/DDI-labels/326e8ab0-6886-4749-9544-885b37070051.html,2015-09-14 11:21:10 -0400,DDI-clinical-trial,evidence-supports,"The effect of paroxetine on the pharmacokinetics of atomoxetine has been evaluated when both drugs were at steady state. In healthy volunteers who were extensive metabolizers of CYP2D6, paroxetine 20 mg daily was given in combination with 20 mg atomoxetine every 12 hours. This resulted in increases in steady state atomoxetine AUC values that were 6- to 8-fold greater and in atomoxetine Cmax values that were 3- to 4-fold greater than when atomoxetine was given alone. Dosage adjustment of atomoxetine may be necessary and it is recommended that atomoxetine be initiated at a reduced dose when it is given with paroxetine.",ncit:positive,ncit:quantitative,paroxetine,http://dbmi-icode-01.dbmi.pitt.edu:2020/vocab/resource/active-ingredient,dikbD2R:precipitant-drug-of-interaction,20,atomoxetine,http://dbmi-icode-01.dbmi.pitt.edu:2020/vocab/resource/active-ingredient,dikbD2R:object-drug-of-interaction,20,Q12,Oral,Unk,Daily,Oral,Unk,Unk,6-8,Fold,Increase,Unk,UNK,UNK,3-4,Fold,Increase,Unk,UNK,UNK
http://dbmi-icode-01.dbmi.pitt.edu:80/DDI-labels/326e8ab0-6886-4749-9544-885b37070051.html,2015-09-14 11:21:10 -0400,DDI-clinical-trial,evidence-supports,"Many drugs, including most drugs effective in the treatment of major depressive disorder (paroxetine, other SSRIs and many tricyclics), are metabolized by the cytochrome P450 isozyme CYP2D6. Like other agents that are metabolized by CYP2D6, paroxetine may significantly inhibit the activity of this isozyme. In most patients (>90%), this CYP2D6 isozyme is saturated early during dosing with paroxetine. In 1 study, daily dosing of paroxetine (20 mg once daily) under steady-state conditions increased single dose desipramine (100 mg) Cmax, AUC, and T½ by an average of approximately 2-, 5-, and 3-fold, respectively. ",ncit:positive,ncit:quantitative,desipramine,http://dbmi-icode-01.dbmi.pitt.edu:2020/vocab/resource/active-ingredient,dikbD2R:object-drug-of-interaction,20,paroxetine,http://dbmi-icode-01.dbmi.pitt.edu:2020/vocab/resource/active-ingredient,dikbD2R:precipitant-drug-of-interaction,100,SD,Oral,Unk,Daily,Oral,Unk,Unk,5,Fold,Increase,Unk,UNK,UNK,2,Fold,Increase,3,Fold,Increase
http://dbmi-icode-01.dbmi.pitt.edu:80/DDI-labels/326e8ab0-6886-4749-9544-885b37070051.html,2015-09-14 11:21:10 -0400,DDI-clinical-trial,evidence-supports,"Concomitant use of paroxetine with risperidone, a CYP2D6 substrate has also been evaluated. In 1 study, daily dosing of paroxetine 20 mg in patients stabilized on risperidone (4 to 8 mg/day) increased mean plasma concentrations of risperidone approximately 4-fold, decreased 9-hydroxyrisperidone concentrations approximately 10%, and increased concentrations of the active moiety (the sum of risperidone plus 9-hydroxyrisperidone) approximately 1.4-fold.",ncit:positive,ncit:quantitative,paroxetine,http://dbmi-icode-01.dbmi.pitt.edu:2020/vocab/resource/active-ingredient,dikbD2R:precipitant-drug-of-interaction,4-8,risperidone,http://dbmi-icode-01.dbmi.pitt.edu:2020/vocab/resource/active-ingredient,dikbD2R:object-drug-of-interaction,20,Daily,Oral,Unk,Daily,Oral,Unk,Unk,4,Fold,Increase,Unk,UNK,UNK,Unk,UNK,UNK,Unk,UNK,UNK
http://dbmi-icode-01.dbmi.pitt.edu:80/DDI-labels/326e8ab0-6886-4749-9544-885b37070051.html,2015-09-14 11:03:10 -0400,DDI-clinical-trial,evidence-supports,"Phenobarbital induces many cytochrome P450 (oxidative) enzymes. When a single oral 30 mg dose of paroxetine was administered at phenobarbital steady state (100 mg once daily for 14 days), paroxetine AUC and T½ were reduced (by an average of 25% and 38%, respectively) compared to paroxetine administered alone. The effect of paroxetine on phenobarbital pharmacokinetics was not studied. Since paroxetine exhibits nonlinear pharmacokinetics, the results of this study may not address the case where the 2 drugs are both being chronically dosed. No initial dosage adjustment of paroxetine is considered necessary when coadministered with phenobarbital; any subsequent adjustment should be guided by clinical effect.",ncit:positive,ncit:quantitative,phenobarbital,http://dbmi-icode-01.dbmi.pitt.edu:2020/vocab/resource/active-ingredient,dikbD2R:precipitant-drug-of-interaction,30,paroxetine,http://dbmi-icode-01.dbmi.pitt.edu:2020/vocab/resource/active-ingredient,dikbD2R:object-drug-of-interaction,100,SD,Oral,1,Daily,Oral,14,Unk,25,Percent,Decrease,Unk,UNK,UNK,Unk,UNK,UNK,38,Percent,Decrease
http://dbmi-icode-01.dbmi.pitt.edu:80/DDI-labels/326e8ab0-6886-4749-9544-885b37070051.html,2015-09-14 11:03:10 -0400,DDI-clinical-trial,evidence-supports,"When a single oral 30 mg dose of paroxetine was administered at phenytoin steady state (300 mg once daily for 14 days), paroxetine AUC and T½ were reduced (by an average of 50% and 35%, respectively) compared to paroxetine administered alone. In a separate study, when a single oral 300 mg dose of phenytoin was administered at paroxetine steady state (30 mg once daily for 14 days), phenytoin AUC was slightly reduced (12% on average) compared to phenytoin administered alone. Since both drugs exhibit nonlinear pharmacokinetics, the above studies may not address the case where the 2 drugs are both being chronically dosed. No initial dosage adjustments are considered necessary when these drugs are coadministered; any subsequent adjustments should be guided by clinical effect (see ADVERSE REACTIONS: Postmarketing Reports).",ncit:positive,ncit:quantitative,phenytoin,http://dbmi-icode-01.dbmi.pitt.edu:2020/vocab/resource/active-ingredient,dikbD2R:precipitant-drug-of-interaction,30,paroxetine,http://dbmi-icode-01.dbmi.pitt.edu:2020/vocab/resource/active-ingredient,dikbD2R:object-drug-of-interaction,300,SD,Oral,1,Daily,Oral,14,Unk,50,Percent,Decrease,Unk,UNK,UNK,Unk,UNK,UNK,35,Percent,Decrease
http://dbmi-icode-01.dbmi.pitt.edu:80/DDI-labels/326e8ab0-6886-4749-9544-885b37070051.html,2015-09-14 11:00:37 -0400,DDI-clinical-trial,evidence-supports,"Cimetidine inhibits many cytochrome P450 (oxidative) enzymes. In a study where paroxetine (30 mg once daily) was dosed orally for 4 weeks, steady-state plasma concentrations of paroxetine were increased by approximately 50% during coadministration with oral cimetidine (300 mg three times daily) for the final week. Therefore, when these drugs are administered concurrently, dosage adjustment of paroxetine after the 20 mg starting dose should be guided by clinical effect. The effect of paroxetine on cimetidine’s pharmacokinetics was not studied.",ncit:positive,ncit:quantitative,paroxetine,http://dbmi-icode-01.dbmi.pitt.edu:2020/vocab/resource/active-ingredient,dikbD2R:object-drug-of-interaction,30,cimetidine,http://dbmi-icode-01.dbmi.pitt.edu:2020/vocab/resource/active-ingredient,dikbD2R:precipitant-drug-of-interaction,300,Daily,Oral,28,TID,Oral,7,Unk,Unk,UNK,UNK,Unk,UNK,UNK,Unk,UNK,UNK,Unk,UNK,UNK
http://dbmi-icode-01.dbmi.pitt.edu:80/DDI-labels/326e8ab0-6886-4749-9544-885b37070051.html,2015-09-14 10:51:15 -0400,DDI-clinical-trial,evidence-supports,"In a controlled study of healthy volunteers, after paroxetine was titrated to 60 mg daily, coadministration of a single dose of 2 mg pimozide was associated with mean increases in pimozide AUC of 151% and Cmax of 62%, compared to pimozide administered alone. The increase in pimozide AUC and Cmax is due to the CYP2D6 inhibitory properties of paroxetine. Due to the narrow therapeutic index of pimozide and its known ability to prolong the QT interval, concomitant use of pimozide and paroxetine is contraindicated (see CONTRAINDICATIONS).",ncit:positive,ncit:quantitative,paroxetine,http://dbmi-icode-01.dbmi.pitt.edu:2020/vocab/resource/active-ingredient,dikbD2R:precipitant-drug-of-interaction,2,pimozide,http://dbmi-icode-01.dbmi.pitt.edu:2020/vocab/resource/active-ingredient,dikbD2R:object-drug-of-interaction,60,SD,Oral,1,Daily,Oral,Unk,Unk,151,Percent,Increase,Unk,UNK,UNK,62,Percent,Increase,Unk,UNK,UNK
http://dbmi-icode-01.dbmi.pitt.edu:80/DDI-labels/53664f8d-3a93-9f2b-daee-380707e4062c.html,2015-09-10 15:01:13 -0400,DDI-clinical-trial,evidence-supports,"In a study of 13 healthy, male volunteers, a single 40 mg dose of tacrine added to fluvoxamine 100 mg/day administered at steady-state was associated with 5- and 8-fold increases in tacrine Cmax and AUC, respectively, compared to the administration of tacrine alone. Five subjects experienced nausea, vomiting, sweating, and diarrhea following coadministration, consistent with the cholinergic effects of tacrine. ",ncit:positive,ncit:quantitative,fluvoxamine,http://dbmi-icode-01.dbmi.pitt.edu:2020/vocab/resource/active-ingredient,dikbD2R:precipitant-drug-of-interaction,40,tacrine,http://dbmi-icode-01.dbmi.pitt.edu:2020/vocab/resource/active-ingredient,dikbD2R:object-drug-of-interaction,100,SD,Oral,1,Daily,Oral,Unk,13,8,Fold,Increase,Unk,UNK,UNK,5,Fold,Increase,Unk,UNK,UNK
http://dbmi-icode-01.dbmi.pitt.edu:80/DDI-labels/53664f8d-3a93-9f2b-daee-380707e4062c.html,2015-09-10 15:01:13 -0400,DDI-clinical-trial,evidence-supports,"Coadministration of fluvoxamine maleate 100 mg per day with atenolol 100 mg per day (N = 6) did not affect the plasma concentrations of atenolol. Unlike propranolol and metoprolol which undergo hepatic metabolism, atenolol is eliminated primarily by renal excretion. ",ncit:negative,ncit:quantitative,atenolol,http://dbmi-icode-01.dbmi.pitt.edu:2020/vocab/resource/active-ingredient,dikbD2R:object-drug-of-interaction,100,fluvoxamine maleate,http://dbmi-icode-01.dbmi.pitt.edu:2020/vocab/resource/active-ingredient,dikbD2R:precipitant-drug-of-interaction,100,Daily,Oral,Unk,Daily,Oral,Unk,6,Unk,UNK,UNK,Unk,UNK,UNK,Unk,UNK,UNK,Unk,UNK,UNK
http://dbmi-icode-01.dbmi.pitt.edu:80/DDI-labels/53664f8d-3a93-9f2b-daee-380707e4062c.html,2015-09-10 15:01:13 -0400,DDI-clinical-trial,evidence-supports,"A study of multiple doses of fluvoxamine maleate (50 mg b.i.d.) in healthy male volunteers (N = 12) and a single dose of lorazepam (4 mg single dose) indicated no significant pharmacokinetic interaction. On average, both lorazepam alone and lorazepam with fluvoxamine produced substantial decrements in cognitive functioning; however, the coadministration of fluvoxamine and lorazepam did not produce larger mean decrements compared to lorazepam alone. ",ncit:negative,ncit:quantitative,fluvoxamine,http://dbmi-icode-01.dbmi.pitt.edu:2020/vocab/resource/active-ingredient,dikbD2R:object-drug-of-interaction,4,lorazepam,http://dbmi-icode-01.dbmi.pitt.edu:2020/vocab/resource/active-ingredient,dikbD2R:precipitant-drug-of-interaction,50,BID,Oral,Unk,SD,Oral,1,12,Unk,UNK,UNK,Unk,UNK,UNK,Unk,UNK,UNK,Unk,UNK,UNK
http://dbmi-icode-01.dbmi.pitt.edu:80/DDI-labels/53664f8d-3a93-9f2b-daee-380707e4062c.html,2015-09-10 15:01:13 -0400,DDI-clinical-trial,evidence-supports,"Coadministration of fluvoxamine maleate 100 mg per day and propranolol 160 mg per day in normal volunteers resulted in a mean 5-fold increase (range 2 to 17) in minimum propranolol plasma concentrations. In this study, there was a slight potentiation of the propranolol-induced reduction in heart rate and reduction in the exercise diastolic pressure. ",ncit:positive,ncit:quantitative,fluvoxamine maleate,http://dbmi-icode-01.dbmi.pitt.edu:2020/vocab/resource/active-ingredient,dikbD2R:precipitant-drug-of-interaction,160,propranolol,http://dbmi-icode-01.dbmi.pitt.edu:2020/vocab/resource/active-ingredient,dikbD2R:object-drug-of-interaction,100,Daily,Oral,Unk,Daily,Oral,Unk,Unk,Unk,UNK,UNK,Unk,UNK,UNK,5,Fold,Increase,Unk,UNK,UNK
http://dbmi-icode-01.dbmi.pitt.edu:80/DDI-labels/53664f8d-3a93-9f2b-daee-380707e4062c.html,2015-09-10 15:01:13 -0400,DDI-clinical-trial,evidence-supports,Administration of fluvoxamine maleate 100 mg daily for 18 days (N = 8) did not significantly affect the pharmacokinetics of a 1.25 mg single intravenous dose of digoxin. ,ncit:positive,ncit:quantitative,digoxin,http://dbmi-icode-01.dbmi.pitt.edu:2020/vocab/resource/active-ingredient,dikbD2R:object-drug-of-interaction,100,fluvoxamine maleate,http://dbmi-icode-01.dbmi.pitt.edu:2020/vocab/resource/active-ingredient,dikbD2R:precipitant-drug-of-interaction,1.25,SD,IV,1,Daily,Oral,18,8,Unk,UNK,UNK,Unk,UNK,UNK,Unk,UNK,UNK,Unk,UNK,UNK
http://dbmi-icode-01.dbmi.pitt.edu:80/DDI-labels/53664f8d-3a93-9f2b-daee-380707e4062c.html,2015-09-10 15:01:13 -0400,DDI-clinical-trial,evidence-supports,"A study of multiple doses of fluvoxamine maleate (50 mg b.i.d.) in healthy male volunteers (N = 12) and a single dose of lorazepam (4 mg single dose) indicated no significant pharmacokinetic interaction. On average, both lorazepam alone and lorazepam with fluvoxamine produced substantial decrements in cognitive functioning; however, the coadministration of fluvoxamine and lorazepam did not produce larger mean decrements compared to lorazepam alone. ",ncit:negative,ncit:quantitative,lorazepam,http://dbmi-icode-01.dbmi.pitt.edu:2020/vocab/resource/active-ingredient,dikbD2R:object-drug-of-interaction,4,fluvoxamine,http://dbmi-icode-01.dbmi.pitt.edu:2020/vocab/resource/active-ingredient,dikbD2R:precipitant-drug-of-interaction,50,SD,Oral,1,BID,Oral,Unk,12,Unk,UNK,UNK,Unk,UNK,UNK,Unk,UNK,UNK,Unk,UNK,UNK
http://dbmi-icode-01.dbmi.pitt.edu:80/DDI-labels/5f356c1b-96bd-4ef1-960c-91cf4905e6b1.html,2015-09-10 14:41:16 -0400,DDI-clinical-trial,evidence-supports,"Olanzapine — Fluoxetine (60 mg single dose or 60 mg daily dose for 8 days) causes a small (mean 16%) increase in the maximum concentration of olanzapine and a small (mean 16%) decrease in olanzapine clearance. The magnitude of the impact of this factor is small in comparison to the overall variability between individuals, and therefore dose modification is not routinely recommended. ",ncit:positive,ncit:quantitative,Fluoxetine,http://dbmi-icode-01.dbmi.pitt.edu:2020/vocab/resource/active-ingredient,dikbD2R:precipitant-drug-of-interaction,Unk,olanzapine,http://dbmi-icode-01.dbmi.pitt.edu:2020/vocab/resource/active-ingredient,dikbD2R:object-drug-of-interaction,60,UNK,UNK,Unk,Daily,Oral,8,Unk,Unk,UNK,UNK,16,Percent,Decrease,16,Percent,Increase,Unk,UNK,UNK
